date,text,url,title,source_domain,authors,description,language
2025-03-29,"Delhi Capitals star wicket-keeper batter KL Rahul has joined the franchise for the ongoing Indian Premier League 2025, after missing the first match of the season against Lucknow Super Giants. KL Rahul reportedly missed the DC vs LSG IPL 2025 match as he was attending his child's birth. He and his wife Athiya Shetty are blessed with a baby girl. Delhi Capitals took to their official ""X"" account to announce the joining of KL Rahul with the rest of the squad ahead of the DC vs SRH IPL 2025 match at the ACA-VDCA Cricket Stadium in Visakhapatnam. In the video, KL Rahul was seen arriving and practicing his shots rigorously at the nets. KL Rahul and Wife Athiya Shetty Blessed With Baby Girl, Couple Confirms Good News On Instagram.
KL Rahul Joins Delhi Capitals Squad in IPL 2025:
The wait is over 🥹🔥 pic.twitter.com/fuLHP7dOrd — Delhi Capitals (@DelhiCapitals) March 29, 2025
(SocialLY brings you all the latest breaking news, viral trends and information from social media world, including Twitter (X), Instagram and Youtube. The above post is embeded directly from the user's social media account and LatestLY Staff may not have modified or edited the content body. The views and facts appearing in the social media post do not reflect the opinions of LatestLY, also LatestLY does not assume any responsibility or liability for the same.)",https://www.latestly.com/socially/sports/cricket/kl-rahul-joins-delhi-capitals-squad-spotted-batting-in-nets-ahead-of-dc-vs-srh-ipl-2025-match-watch-video-6743588.html,"KL Rahul Joins Delhi Capitals Squad, Spotted Batting in Nets Ahead of DC vs SRH IPL 2025 Match (Watch Video)",www.latestly.com,Rahul Patra,"KL Rahul has joined the Delhi Capitals ahead of the DC vs SRH IPL 2025 match after missing the first game to attend his child's birth. Scroll below to see him batting in the nets. 🏏 KL Rahul Joins Delhi Capitals Squad, Spotted Batting in Nets Ahead of DC vs SRH IPL 2025 Match (Watch Video).",en
2025-03-29,"From Seattle to Miami, anti-Musk protesters gather at hundreds of Tesla locations

toggle caption Charly Triballeau/AFP via Getty Images

LOS ANGELES — Tesla facilities worldwide have been the target of protests objecting to Tesla CEO Elon Musk's influential role in the Trump administration. On Saturday, anti-Musk protesters gathered again in what were their most ambitious and widespread rallies yet.

As part of the ""Tesla Takedown"" campaign, nonviolent demonstrations took place across the U.S. and even abroad on Saturday. Organizers called it a ""global day of action"" and said protests occurred in at least 253 cities around the world.

For weeks, the movement's organizers have been encouraging people to boycott the EV maker by selling their Tesla cars and stocks. According to Tesla Takedown, thousands of grassroots groups and individuals worldwide are driving the decentralized effort.

Sponsor Message

Musk and the White House did not respond to NPR's request for comment.



Protests erupt nationwide, raising alarms about Musk, democracy and the future of Social Security

At a rally in Los Angeles on Saturday, Phil Ansell, 65, said he felt compelled to join because he believes President Trump and Musk pose a threat to democracy.

toggle caption Emma Bowman/NPR

""I want to do everything possible to protect democracy in this country,"" he said. ""Trump and Musk are acting like kings.""

Ansell added that he was especially excited to participate, seeing how far and wide the protest movement had spread.

Many people at the Los Angeles rally voiced deep concern over the devastating effect that the Trump administration's cuts and proposed changes could have on Social Security.

Francine Coeytaux, 72, who also attended the LA protest, said she showed up because she has a 37-year-old daughter with special needs who relies on Social Security benefits.

toggle caption Lindsey Wasson/AP

""It's what allows her to live independently and to be able to pay rent and pay [for] food,"" she said. ""She's literally existing and living thanks to Social Security.""

Beyond Los Angeles, demonstrations took place across small and major cities, in both red and blue states.

In Dallas, demonstrators held up a banner reading ""Store closing. Everything must go!"" outside of a Tesla dealership, according to a photo from an attendee posted on Facebook.

Sponsor Message

On a busy street in St. Louis County, Mo., protesters waved signs that read ""No one elected Musk"" and ""Drive Tesla out of Biz"" as cars passed by, FOX 2 reported.

And in New York City, near a Tesla showroom, a massive crowd chanted ""Elon Musk shame on you. We deserve a future too,"" according to a video on Facebook.



How the Tesla Takedown movement began

Organizers say the Tesla Takedown movement is fueled by anger over Musk's slashing of the federal government, and that it aims to hit the billionaire where it hurts — the electric vehicle company that's become his main source of wealth.

Joel Lava, who has been helping lead Tesla Takedown protests in Los Angeles, says Musk's work to dismantle government agencies and workforce through the unofficially named DOGE initiative is the primary motivator for the movement's members.

toggle caption Brandon Bell/Getty Images

""He's spearheading DOGE, which is spearheading our country's destruction — literally destroying our country's infrastructure,"" Lava said. ""Therefore, we are taking direct aim at his power, which is his wealth, which is Tesla.""

Musk critics point to a litany of other grievances, including his attacks on diversity, a gesture he made on the Inauguration Day stage that was widely interpreted to be a Nazi salute, and his support for far-right parties.



Musk's response to the pushback against Teslas

Since Musk's political turn, Tesla sales have slumped, and investors have grown uneasy. But market analysts question how much the dip in Tesla sales and shares can be pinned on its CEO's actions. Tesla has been losing market share to EV competitors for years. And the stock price has fallen in anticipation of auto tariffs. But the Trump administration's recently announced 25% import tariffs on cars made outside the U.S. could give the stock a welcome boost; auto industry analysts say that among domestic carmakers, Tesla will be the least impacted by the tariffs.

toggle caption Miguel J. Rodriguez Carrillo/AFP via Getty Images

Some of the anti-Musk backlash has been violent. Tesla vehicles, dealerships and charging stations across the U.S. and in Europe have been the target of arson and vandalism. Some have taken to spray-painting swastikas on Tesla sedans and Cybertrucks.

Sponsor Message

Tesla Takedown organizers say its participants are exercising their right to peacefully protest and that they oppose violence and property destruction.

But Musk did not make that distinction when he went after Valerie Costa, a community activist who has helped organize recent peaceful protests in the Seattle area as part of the Tesla Takedown demonstrations.

Musk, in a post on X earlier this month, accused Costa of ""committing crimes,"" without giving evidence or specific allegations. That was after he claimed that an environmental activist group she cofounded was backed by the ActBlue, a fundraising platform for Democrats.

toggle caption Rebecca Blackwell/AP

Costa told NPR that the accusations were false, and that Musk supporters subsequently targeted her in direct messages that included threats of physical violence.

""When one of the most powerful, if not the most powerful person in the world is saying you've committed a crime, it doesn't matter what the truth is,"" Costa said.

Tesla Takedown organizers say they want to chip away at Musk's power, and that starts with tarnishing Tesla's brand.

""Trump only likes [Musk] because he's rich,"" Lava, the LA-based organizer, said. ""If suddenly Musk becomes just another boring, low-end billionaire, Trump will dump him too, and that will also show the power we have as people to effect change.""",https://www.npr.org/2025/03/29/nx-s1-5343986/anti-musk-protests-planned-worldwide,"From Seattle to Miami, anti-Musk protesters gather at hundreds of Tesla locations",http://www.npr.org,,,
2025-03-29,"A 4.7-magnitude earthquake struck Afghanistan on Saturday morning, a day after a powerful 7.7-magnitude quake hit Myanmar. The National Center for Seismology reported that the earthquake occurred at 5:16 AM IST at a depth of 180 km. The epicenter was located at 36.50°N latitude and 71.12°E longitude. The tremors come amid heightened seismic activity in the region, raising concerns about potential aftershocks. Myanmar Earthquake Update: State of Emergency Declared in Its Capital After 7.7 Magnitude Quake Hits Country’s Second Largest City.
Earthquake in Afghanistan
An earthquake with a magnitude of 4.7 on the Richter Scale hit Afghanistan at 5.16 IST today (Source - National Center for Seismology) pic.twitter.com/PkfTSO1k6v — ANI (@ANI) March 29, 2025
(SocialLY brings you all the latest breaking news, viral trends and information from social media world, including Twitter (X), Instagram and Youtube. The above post is embeded directly from the user's social media account and LatestLY Staff may not have modified or edited the content body. The views and facts appearing in the social media post do not reflect the opinions of LatestLY, also LatestLY does not assume any responsibility or liability for the same.)",https://www.latestly.com/socially/world/earthquake-in-afghanistan-quake-of-magnitude-4-7-hits-country-day-after-powerful-temblor-rocked-myanmar-6743202.html,Earthquake in Afghanistan: Quake of Magnitude 4.7 Hits Country Day After Powerful Temblor Rocked Myanmar,www.latestly.com,Team Latestly,"A 4.7-magnitude earthquake struck Afghanistan on Saturday morning, a day after a powerful 7.7-magnitude quake hit Myanmar. The National Center for Seismology reported that the earthquake occurred at 5:16 AM IST at a depth of 180 km. 🌎 Earthquake in Afghanistan: Quake of Magnitude 4.7 Hits Country Day After Powerful Temblor Rocked Myanmar.",en
