date,text,url,title,source_domain,authors,description,language
2025-03-09,"The India national cricket team remained unbeaten and won the ICC Champions Trophy 2025 tournament after defeating the New Zealand national cricket team by four wickets at the Dubai International Cricket Stadium in Dubai on Sunday. Indian captain Rohit Sharma was adjudged Player of the Match for playing a match-winning knock of 76 runs off 83 deliveries. Team India won their ICC Champions Trophy title. After winning the Champions Trophy 2025, Indian stalwart Virat Kohli hugged his wife and Bollywood actress Anushka Sharma. The video of Kohli and Anushka's adorable moment has gone viral on the social space. Below is the viral hug video of Kohli and Anushka. Rohit Sharma, Virat Kohli Play Dandiya With Stumps After India's ICC Champions Trophy 2025 Title Win (Watch Video).
Warm Hug Between Virat Kohli and Anushka Sharma
(SocialLY brings you all the latest breaking news, viral trends and information from social media world, including Twitter (X), Instagram and Youtube. The above post is embeded directly from the user's social media account and LatestLY Staff may not have modified or edited the content body. The views and facts appearing in the social media post do not reflect the opinions of LatestLY, also LatestLY does not assume any responsibility or liability for the same.)",https://www.latestly.com/socially/sports/cricket/adorable-moment-virat-kohli-hugs-anushka-sharma-after-india-win-icc-champions-trophy-2025-title-beating-new-zealand-by-four-wickets-watch-video-6698306.html,Adorable Moment! Virat Kohli Hugs Anushka Sharma After India Win ICC Champions Trophy 2025 Title Beating New Zealand by Four Wickets (Watch Video),www.latestly.com,Team Latestly,"After winning the ICC Champions Trophy 2025 tournament in Dubai, Indian stalwart Virat Kohli hugged his wife and Bollywood actress Anushka Sharma. The Rohit Sharma-led side defeated New Zealand by four wickets in a thrilling grand finale. 🏏 Adorable Moment! Virat Kohli Hugs Anushka Sharma After India Win ICC Champions Trophy 2025 Title Beating New Zealand by Four Wickets (Watch Video).",en
2025-03-09,"President Donald Trump says there is an easy way for manufacturers to avoid his blizzard of tariffs: Move back to the United States. If it works, Trump’s tariff-first strategy could end a long stagnation in U.S. manufacturing output and create the kind of jobs that his blue-collar supporters crave.

“What they have to do is build their car plants, frankly, and other things, in the United States, in which case they have no tariffs,” the president said last week.

But in trying to repatriate manufacturing, Trump is battling powerful long-term forces that have caused factory jobs to dwindle to the smallest share of U.S. employment since government records began in 1939. Just 8 percent of American workers now toil in factories, according to the Bureau of Labor Statistics.

Advertisement

Trump’s policies also work at cross-purposes. The steel and aluminum tariffs that take effect on Wednesday, for example, will mean higher costs for automakers and appliance manufacturers that use those metals. His plans for mass deportations of migrants will make it harder to find new factory workers, with the economy already operating at full employment.

Even if Trump succeeds in luring companies inside his tariff walls, it is unlikely he could regain the nearly 5 million factory jobs that have vanished since the late 1990s, according to many economists.

Machines greatly outnumber workers in modern factories. The jobs that remain require higher skills and no longer pay more than other opportunities available to workers without a college degree. Trump’s trade policy, against all odds, is trying to re-create an economy — and a way of life — that hasn’t really existed in the United States for decades.

Advertisement

“Tariffs by themselves can’t be a solution,” said Robert Lawrence, a professor of international trade and investment at Harvard University’s Kennedy School of Government.

Trump has long attacked the global economy as fundamentally unfair. Foreign nations, he insists, take advantage of the United States through unbalanced trade deals even as Washington provides a defense umbrella for them.

Relocating the auto plants, furniture factories and other workshops that moved offshore during an era of hyper-globalization is the president’s answer to a chronic U.S. trade deficit that topped $1.2 trillion last year, a record.

The president’s goal is “to rebalance the international economic system,” Treasury Secretary Scott Bessent said in a speech Thursday. Global trade is distorted by countries such as China that suppress consumer demand and rely on export sales to keep their factories busy, he said.

Advertisement

Subsidized Chinese factories churn out products at prices that American producers often cannot match, leading to a mammoth U.S. trade deficit and starving American factories of orders and jobs.

“This system is not sustainable,” Bessent told the Economic Club of New York.

The administration is reorienting U.S. trade policy. Instead of trying to provide what Bessent called “cheap goods” for consumers, the administration prioritizes creating good manufacturing jobs for workers.

That could prove a tough lift.

Manufacturing employment peaked in the disco-era summer of 1979 at 19.5 million jobs. Over the next 20 years, roughly 2 million of them disappeared as automation allowed fewer workers to produce more goods. Then, amid China’s economic rise and entry into the global trading system, manufacturing employment plunged by almost 6 million jobs between 1998 and 2010.

Advertisement

In his first term as president, Trump made limited progress reviving the nation’s factories by imposing tariffs on roughly two-thirds of what Americans bought from China.

Manufacturing employment rose by a modest 411,000 jobs between his inauguration and early 2020, on the eve of the pandemic.

His successor, President Joe Biden, tried to use industrial policy — a blend of tax incentives and subsidies — to spark a manufacturing revival. Companies more than tripled their spending on the construction of new factories. But the employment gains were muted. Manufacturing jobs peaked at 12.9 million in early 2023, just 110,000 above Trump’s first-term peak.

Tariff supporters say a greater emphasis on manufacturing is essential for both strong communities and a strong defense, citing the experience of an earlier period.

Advertisement

From 1950 until the early 1980s, the U.S. current account, the broadest measure of the nation’s trade balance, was usually in surplus. The last 40 years, however, have seen a chronic deficit that many analysts blame for the hollowing-out of manufacturing-dependent communities.

“We’ve been rowing in the wrong direction on trade and industrial policy for 30 or 40 years. And no, it’s not going to change overnight. But that’s not an excuse to do nothing,” said Mark DiPlacido, a policy adviser with American Compass, a conservative group.

Where mainstream economists see global integration as the most efficient way of producing the goods and services that Americans demand, the president has said “we don’t need” what our trading partners sell us. Rather than buy Canadian lumber or oil, Trump prefers American alternatives.

Advertisement

“We want factory production in America. We want employment to blossom in America,” Commerce Secretary Howard Lutnick told reporters on Thursday. “We’re going to bring factories back to America.”

In the best case, if enough factories returned to eliminate the trade deficit for the first time in decades, perhaps 2 million new jobs could be created, according to an estimate by Harvard’s Lawrence. That’s a significant number, though just a fraction of the total that disappeared since globalization hit high gear. And it would come at a cost.

At 1 percent of gross domestic product, the tariffs that Trump has proposed so far amount to one of the largest tax increases ever imposed, according to economist Dean Baker of the Center for Economic and Policy Research, a left-leaning think tank in Washington.

Advertisement

Bringing footloose factories back to the United States may not deliver the high-paying, blue-collar jobs that some advocates anticipate. Factory work once enjoyed a reputation for offering better pay and benefits than other jobs that did not require a college degree. But that wage premium for production workers “disappeared” in 2006, concluded a 2022 study by Federal Reserve economists, which said a fall in union membership accounted for most of the decline.

Still, steady jobs offering regular hours provide other benefits beyond a paycheck, according to Susan Helper, an economics professor at Case Western Reserve University in Cleveland.

“When GM closed its Lordstown [Ohio] plant, one of the things people talked about was the loss of Sunday school teachers and Cub Scout pack leaders,” she said. “Because if you worked at GM, you could have only one job and support your family. If you worked elsewhere, you had two or three jobs and had no time for civic engagement.”

Advertisement

The president’s on-again, off-again tariff diplomacy is not making his quest any easier. Trump first promised tariffs on Canada and Mexico in late January, delayed them for one month in early February, imposed them on Tuesday, exempted automakers from them on Wednesday and then granted both nations another month-long reprieve on Thursday.

At the end of that period, the president plans to introduce a comprehensive system of “reciprocal” tariffs, matching the import taxes that other nations apply to U.S. goods in a move that would thoroughly upend long-standing trade norms.

“If you’re outside of the United States, it’s going to be a little bit different,” Trump said Thursday.

The nonstop blitz of activity since Inauguration Day has left the producers Trump says he wants to help gasping for air and puzzled over where to invest. More than three-quarters of respondents cited “trade uncertainties” as their biggest challenge, more than twice the pre-election share, according to the latest survey by the National Association of Manufacturers.

To truly pull off a manufacturing revolution, Trump needs CEOs to change their spending habits. The shift over the past quarter-century to rely on factories outside the United States — and their low-wage laborers — left corporations with plenty of extra cash. But that money has largely gone to shareholders rather than to developing domestic manufacturing capacity.

Corporations today devote roughly 70 percent of the funds that are left over after paying expenses to repurchasing shares of their own stock and paying shareholder dividends, according to Stephen Blitz, chief U.S. economist for TS Lombard, an economic consultancy.

“You have to make it less profitable to build it elsewhere. And tariffs are a way to do that. But it’s a very blunt instrument,” Blitz said.

One problem is timing. Trump last week agreed to exempt automakers from his announced 25 percent tariffs on Canadian and Mexican goods until April 2, when he plans to announce his reciprocal tariffs. But he is also demanding that U.S. automakers begin moving production back to the United States in the next 30 days — an impossibly quick pace, according to supply chain specialists.

“You can’t just tell GM, ‘It’s too expensive to buy headlights from China,’” Blitz said. “Nobody makes headlights in the United States. So then all you’re doing is adding cost without really giving time for an adjustment.”

The White House, meanwhile, is taking credit for new manufacturing investments. On Thursday, Rodolphe Saadé, the CEO of the French shipping line CMA CGM, appeared with Trump in the Oval Office to announce a $20 billion investment in the United States.

The president also has hailed announcements by Apple, TSMC and Honda, which he said would be opening a plant in Indiana.",https://www.washingtonpost.com/business/2025/03/09/trump-tariffs-factories/,Trump’s tariffs face long odds in bid to bring factories home,http://washingtonpost.com,,,
2025-03-09,"A small brush fire prompted the temporary closure of southbound lanes of the SR-2 freeway in Glendale on Sunday evening.
Firefighters are referring to the blaze as the Mountain Fire, which is located near the 2100 block of Haven Street, according to the California Highway Patrol.
It's unclear how or when the fire started, but all southbound lanes were closed at around 7:30 p.m. as the firefight continued. They were expected to be reopened to all traffic by 8:15 p.m.
Crews could be seen working to battle the fire both from above the flames on the hillside overlooking the freeway and from the road with SkyCal over the scene.
A buildup of traffic could be seen gradually growing as the emergency vehicles remained blocking the freeway.
This is a developing story. Check back for details.",https://www.cbsnews.com/losangeles/news/mountain-fire-glendale-2-freeway-southbound-closed/,Brush fire forces temporary closure of southbound SR-2 freeway in Glendale,www.cbsnews.com,Dean Fioresi,It's unclear how or when the fire started.,en
