date,text,url,title,source_domain,authors,description,language
2025-03-18,"Share Share Article via Facebook Share Article via Twitter Share Article via LinkedIn Share Article via Email

Tickets for June 'Fast Money' Live on sale now

Tickets for June 'Fast Money' Live on sale now",https://www.cnbc.com/video/2025/03/18/tickets-for-june-fast-money-live-on-sale-now.html,Tickets for June 'Fast Money' Live on sale now,http://www.cnbc.com,,,
2025-03-18,"Another day of high fire danger for the Denver metro while snow moves into the mountains
Another day of high fire danger for the Denver metro while snow moves into the mountains
Another day of high fire danger for the Denver metro while snow moves into the mountains
A mixed bag of weather will continue Tuesday night and affect the morning commute across the Denver metro area and the Eastern Plains.
Rain and snow will rapidly develop across Colorado's Front Range Tuesday afternoon. This is a mild storm, so moderate rain could turn to snow in Denver, but accumulations are not anticipated.
As the low develops east of Denver, rain and snow will change to all snow, and it will be heavy at that point. Accumulations are expected east of Denver International Airport and across the Palmer Divide. Snow develops by 10 p.m. at the latest and is already pushing east out of Colorado by 4 a.m.
CBS
Generally light snow totals are expected, but impacts will be moderate to high around Monument Hill, Interstate 70 on the Plains, and Interstate 76.
CBS
Wind gusts of 65 mph are expected overnight and through the morning commute across the Front Range and Plains. This means areas that pick up snow will experience blizzard conditions. I'd plan to avoid travel on any road east of the airport as significant delays and closures are possible.
Blizzard warnings have been posted through 9 a.m. Wednesday:
CBS
Be sure to stay tuned to CBS Colorado as we continue to fine-tune the forecast.",https://www.cbsnews.com/colorado/news/blizzard-warning-colorado-denver-commute-affected-snow-rain-wind/,"Snow, rain and more wind expected in Colorado, some areas on Eastern Plains will be under a blizzard warning",www.cbsnews.com,Joe Ruch,A mixed bag of weather will continue Tuesday night and affect the Wednesday morning commute across the Denver metro area and the Eastern Plains.,en
2025-03-18,"The Kabaddi World Cup 2025 is happening across four cities in West Midlands, England; Birmingham, Coventry, Walsall, and Wolverhampton. Ten nations will compete in the men's Kabaddi World Cup 2025, while in the women's World Cup, six teams will be participating. The grand competition began on March 17, 2025, and will end on March 23, 2025. In both the tournaments, India national kabaddi team are the defending champions. Kabaddi World Cup 2025: India Kickstarts Men’s Title Defence With 64–22 Win Over Italy.
The India men's national kabaddi team are clubbed with Italy, Scotland, Wales, and Hong Kong (China) in Group B of the Men’s Kabaddi World Cup 2025. While the India women's national kabaddi team are clubbed with Wales, and Poland in Group D of the Women’s Kabaddi World Cup 2025. Matches will be played in Wolverhampton on March 17, March 18, March 22, and March 23. While on March 19, games will be hosted in Coventry, on March 20 in Birmingham, and in Walsall on March 21.
How To Watch Live Telecast of Kabaddi World Cup 2025 on TV in India?
DD Sports has the broadcasting rights in India for the Kabaddi World Cup 2025. Hence, fans can avail of viewing options on the DD Sports TV channel for both men's and women's Kabaddi World Cup 2025 for live telecast. For the live streaming viewing option, read more. IPL 2025 Opening Ceremony: Shraddha Kapoor, Varun Dhawan, Arijit Singh Among Star Performers Set to Enthrall Fans Ahead of KKR vs RCB Opener, Says Report.
How To Watch Live Streaming of Kabaddi World Cup 2025 Online in India?
The live streaming viewing options online of the Kabaddi World Cup 2025 will be available on the Olympics channel website. Fans can access the Olympics.com website and DD Sports to catch the Kabaddi World Cup 2025 live streaming online.
(The above story first appeared on LatestLY on Mar 18, 2025 01:10 PM IST. For more news and updates on politics, world, sports, entertainment and lifestyle, log on to our website latestly.com).",https://www.latestly.com/sports/kabaddi/on-which-channel-kabaddi-world-cup-2025-live-telecast-in-india-will-be-available-how-to-watch-kabaddi-world-cup-2025-matches-live-streaming-online-check-viewing-options-6717133.html,On Which Channel Kabaddi World Cup 2025 Live Telecast in India Will Be Available? How To Watch Kabaddi World Cup 2025 Matches Live Streaming Online? Check Viewing Options,www.latestly.com,Rahul Patra,Defending champions India national kabaddi team are competing in Kabaddi World Cup 2025 in England. Fans eager to know where the Kabaddi World Cup 2025 will live telecast and live streaming in India will get the complete information here. 🏆 On Which Channel Kabaddi World Cup 2025 Live Telecast in India Will Be Available? How To Watch Kabaddi World Cup 2025 Matches Live Streaming Online? Check Viewing Options.,en
