date,text,url,title,source_domain,authors,description,language
2025-03-14,"MIT one of dozens of schools under federal investigation for alleged racial discrimination
MIT one of dozens of schools under federal investigation for alleged racial discrimination
MIT one of dozens of schools under federal investigation for alleged racial discrimination
MIT in Cambridge, Massachusetts is among more than 50 universities being investigated for alleged racial discrimination as part of President Donald Trump's campaign to end diversity, equity and inclusion programs that his officials say exclude white and Asian American students.
The Education Department announced the new investigations Friday, one month after issuing a memo warning America's schools and colleges that they could lose federal money over ""race-based preferences"" in admissions, scholarships or any aspect of student life.
Partnership with PhD Project in focus
""Students must be assessed according to merit and accomplishment, not prejudged by the color of their skin,"" Education Secretary Linda McMahon said in a statement. ""We will not yield on this commitment.""
Most of the new inquiries are focused on colleges' partnerships with the PhD Project, a nonprofit that helps students from underrepresented groups get degrees in business with the goal of diversifying the business world.
Department officials said that the group limits eligibility based on race and that colleges that partner with it are ""engaging in race-exclusionary practices in their graduate programs.""
The group of 45 colleges facing scrutiny over ties to the PhD Project include major public universities such as Arizona State, Ohio State and Rutgers, along with prestigious private schools like Yale, Cornell, Duke and MIT.
A message sent to the PhD Project was not immediately returned.
Investigation of race-based scholarships
Six other colleges are being investigated for awarding ""impermissible race-based scholarships,"" the department said, and another is accused of running a program that segregates students on the basis of race.
Those seven are: Grand Valley State University, Ithaca College, the New England College of Optometry, the University of Alabama, the University of Minnesota, the University of South Florida and the University of Tulsa School of Medicine.
The department did not say which of the seven was being investigated for allegations of segregation.
The Feb. 14 memo from Trump's Republican administration was a sweeping expansion of a 2023 Supreme Court decision that barred colleges from using race as a factor in admissions.
That decision focused on admissions policies at Harvard and the University of North Carolina, but the Education Department said it will interpret the decision to forbid race-based policies in any aspect of education, both in K-12 schools and higher education.
In the memo, Craig Trainor, acting assistant secretary for civil rights, had said schools' and colleges' diversity, equity and inclusion efforts have been ""smuggling racial stereotypes and explicit race-consciousness into everyday training, programming and discipline.""
The memo is being challenged in federal lawsuits from the nation's two largest teachers' unions. The suits say the memo is too vague and violates the free speech rights of educators.
WBZ-TV reached out to MIT and the New England College of Optometry for comment. MIT said they have not received a letter but will review it when they do. New England College of Optometry has yet to respond.",https://www.cbsnews.com/boston/news/mit-federal-investigation-anti-dei-trump-administration/,MIT among dozens of universities facing federal investigation as part of Trump's anti-DEI campaign,www.cbsnews.com,The Associated Press,MIT is among more than 50 universities being investigated for alleged racial discrimination by the Trump administration.,en
2025-03-14,"The Penguins have signed Avery Hayes to a two-year entry-level contract.
Hayes, 22, played four seasons in the Ontario Hockey League before signing an AHL contract with the Wilkes-Barre/Scranton Penguins prior to the start of the 2023-24 season.
So far this year, Hayes is fifth-leading scorer for the Pens' AHL affiliate with 17 goals and 18 assists through 44 games.
In total, Hayes has recorded 23 goals, 21 assists, and 44 points in 73 games.
During his four seasons in the OHL, Hayes scored 106 goals and 97 assists in 237 games.
Hayes, a Michigan native, also represented Team USA in the 2019 Under-18 Hlinka Gretzky Cup where he posted one goal and one assist in four games.
The two-year entry-level contract will begin for the 2025-26 season.",https://www.cbsnews.com/pittsburgh/news/pittsburgh-penguins-prospect-avery-hayes-entry-level-contract/,Penguins sign prospect Avery Hayes to entry-level contract,www.cbsnews.com,Mike Darnay,Hayes is fifth-leading scorer for the Pens' AHL affiliate with 17 goals and 18 assists through 44 games this season.,en
2025-03-14,"2 teens arrested in connection with deadly shooting in Aurora
2 teens arrested in connection with deadly shooting in Aurora
2 teens arrested in connection with deadly shooting in Aurora
Two 19-year-olds have been arrested in connection with a deadly shooting in Aurora. The shooting happened in the area of an office park at 10800 block of East Bethany Drive about 9:45 p.m. Tuesday.
Bethany Park in Aurora CBS
When officers arrived, they found a 23-year-old Aurora man, later identified as Yousef Jamal Elnaffar, with an apparent gunshot wound. Elnaffar was rushed to the hospital where he later died.
Isaac Delacruz Aurora Police
Isaac Delacruz was arrested late Thursday night on first-degree murder charges. Investigators said they believe he was the shooter.
Kevin Hernandez-Gonzalez Aurora Police
Kevin Hernandez-Gonzalez faces second-degree murder charges as investigators believe he was an accomplice and driver.
Both are being investigated for additional robberies in the area.
The scene of the shooting near Bethany Drive and Parker Road in Aurora. CBS
Investigators believe Elnaffar traveled to the area after conducting a transaction through an online marketplace when he was shot and killed.",https://www.cbsnews.com/colorado/news/2-arrested-connection-deadly-shooting-bethany-park-aurora/,2 teens arrested in connection with deadly shooting in Aurora,www.cbsnews.com,Jennifer Mcrae,Two 19-year-olds have been arrested in connection with a deadly shooting in Aurora. The shooting happened in the area of an office park​ at 10800 block of East Bethany Drive about 9:45 p.m. Tuesday.,en
