date,text,url,title,source_domain,authors,description,language
2025-03-21,"TALLMADGE, Ohio, March 21, 2025 (GLOBE NEWSWIRE) -- Mitolyn Work has emerged as a boon for all those willing to lose weight quickly and in a healthy way, as per experts. So if you are a health freak and aspire to use a sustainable way of burning those extra calories, Mitolyn can be a good choice. Instead of opting for the traditional technique of diet control or heavy workout, Mitolyn offers a smooth weight loss solution by converting the extra fat into energy. The plant-based ingredients of Mitolyn make it a top choice among health enthusiasts, who aspire to lose weight naturally and healthily.
Unlike the superficial and false claims made by other dietary supplements on the market, Mitolyn is a trustworthy product as it addresses the root cause of unhealthy weight gain and works directly on metabolic efficiency of an individual. Mitolyn capsules' nourishing trait of the powerhouses of each cell results in a long-term weight loss effect.
The composition of Mitolyn includes superfood, adaptogens and antioxidants which not just maintains body energy level but is responsible for the overall wellness of being. Here is deep insight of Mitolyn.
Explore more about Mitolyn by visiting the official website here.
Mitolyn Origin:
Mitolyn originated and was discovered by a popular research scientist Andrew Lambert. It was discovered after many years of continuous research to develop a link between cellular energy release and metabolism. After years of research, it was concluded that Mitolyn can cause sustainable weight loss and natural fat-burning, enhanced energy level without any rigorous physical activity or extreme workout. Know more about individuals feedback about the product.
Mitolyn Review:
Here is a detailed review of Mitolyn is mentioned as per the consumers report.
In an era where thousands of instant body detox products, metabolic enhancers, and diet programs are available, Mitolyn is a scientifically driven formula for weight loss. As per consumer reports, Mitolyn builds the body ability to fight stubborn fat, which is often a challenging situation among fitness freaks. With its reliable and healthy results, Mitolyn has become the first choice among fitness enthusiasts. Below mentioned are some real world transformative stories of Mitolyn consumers:
Connie’s Transformation: After using Mitolyn for quite some time, Connie shed 40 pounds and gained the confidence of enjoying outdoor activity, playing with her children without the feeling of breathlessness.
After using Mitolyn for quite some time, Connie shed 40 pounds and gained the confidence of enjoying outdoor activity, playing with her children without the feeling of breathlessness. Peggy’s Mitolyn Success Story: After consuming Mitolyn for some time, Peggy lost 35 pounds. This helped her in regaining her self-esteem and confidence. She thanks Mitolyn for an effective metabolic boost.
Apart from this, many Mitolyn users stated the side advantages of the product like improved sleep cycle, light mood and increased concentration power. As per experts, Mitolyn optimises cellular energy production by melting the stubborn fat. Some consumers even mentioned that Mitolyn is a medium of breaking free from extreme exercise, strict diet and meal plans.
Discovery Science About Mitolyn Tap To Read Out Visit Official Website
Some Notable Results of Mitolyn
Consistent Fat Loss with Mitolyn: After consistent Mitolyn consumption, users shared before-and-after images showcasing the effective result such as fat burn from stubborn areas after the product consumption.
After consistent Mitolyn consumption, users shared before-and-after images showcasing the effective result such as fat burn from stubborn areas after the product consumption. Developed Self-Confidence with Mitolyn: A number of consumers credited Mitolyn for their enhanced confidence and improved energy levels. They were also able to manage their cravings after consistent consumption of Mitolyn.
A number of consumers credited Mitolyn for their enhanced confidence and improved energy levels. They were also able to manage their cravings after consistent consumption of Mitolyn. Improved Metabolic Rate with Mitolyn: One of the most common feedback which users suggested is significant improvement in their metabolic rate. Therefore, improving healthy weight management.
However, the brand states that integrating Mitolyn with a proper and healthy food combination such as complex carbs, protein, green vegetables etc as well as healthy lifestyle and mild physical workout further accelerate Mitolyn potential.
Mitolyn Critical Review:
Although Mitolyn receives positive response worldwide, it is worthy to mention here some of the critical feedback of the product. To provide a balanced approach to the consumers, here we have mentioned both positive and negative feedback of Mitolyn stated by the users.
Instant Result: Some users expected a quick outcome from Mitolyn. The results sometimes vary person to person. Some lose weight quickly while some shed weight slowly which totally depends on individuals body type and their metabolic rate. However, Mitolyn focuses on long-term and effective results rather than overnight outcomes.
Some users expected a quick outcome from Mitolyn. The results sometimes vary person to person. Some lose weight quickly while some shed weight slowly which totally depends on individuals body type and their metabolic rate. However, Mitolyn focuses on long-term and effective results rather than overnight outcomes. Cost and Product Availability: As Mitolyn is based on highly exotic ingredients, it can cost a little more than the usual weight loss product. Also, the product is only available on Mitolyn official website, so it may restrict product availability for many buyers.
Individual Variations: Mitolyn doesn’t promise standardised “one-size-fits-all” claims. The response rate may vary person to person as per their generic health history. This is the reason Mitolyn provides a 90-day money-back guarantee offer to allow people to have a personal experience and decide accordingly.
Mitolyn Supplement Composition
Mitolyn is made up of six unique plant-based ingredients which as per experts act as a natural “fat burning groove”. Below is the detailed overview of the same:
Maqui Berry in Mitolyn: Extracted from deep-purple fruits containing anthocyanins, Maqui Berry can boost the formation of new mitochondrial structures thereby releasing the stress. Apart from the basic trait of weight loss management, the antioxidants help in other health related benefits as well.
Rhodiola and Mitolyn: Rhodiola which is known as an adaptogenic herb curbs the rise in the cortisol levels, responsible for fat storage. The polyphenols present in Mitolyn helps in maintaining the emotional balance especially for those who tend to consume more food when in stress. Haematococcus in Mitolyn: Haematococcus is a red algae consisting of astaxanthin which is more beneficial than the typical antioxidants. The scientific properties of Haematococcus is such that it helps in protecting the mitochondrial membranes from damage. This feature of Haematococcus helps in production of metabolism. Amla in Mitolyn: Amla, whose scientific name is Indian gooseberry, is rich in essential flavonoids and improves digestive process. Amla content in Mytolyn stimulates the mitochondrial biogenesis process, which helps in proper fat oxidation, thereby maintaining metabolic activity. Theobroma Cacao in Mitolyn: Infused with the property of epicatechin, Theobroma Cacao may boost the nitric oxide levels and improve blood circulation, ensuring proper delivery of nutrients throughout the body. The combination of Mitolyn and Theobroma Cacao enhances body recovery. Schisandra and Mitolyn: Schisandra, which is known for its adaptogenic traits, helps in fine tuning the liver function, mental and skin health. When integrated with Mitolyn, it protects cells from negative effects of stress on the body as well as metabolic rates.
How Mitolyn Provide You Benefits Visiting Official Find Out
Mitolyn Supplement Guide:
The first time users can get a deep insight of how to effectively use Mitolyn as per Consumer Reports on Mitolyn’s Mitochondrial Support
Take Mitolyn First Thing in the Morning: Many users consider it helpful to consume Mitolyn first thing in the morning with water and a light meal to give a boosting start to the day. Consistency is Important: As Mitolyn works on gradually improving the mitochondrial number, consistency in the intake can give better results. Focus on Whole Foods: Along with a healthy and balanced diet such as complex carbs, protein, vegetables, can provide effective metabolic activity. Moderate and Light Exercise: Along with the Mitolyn supplement intake, light to moderate exercise like brisk walking, yoga, and easy workouts can enhance the further fat burning process. Keep Hydrated: Proper intake of water along with Mitolyn supplement provides proper absorption of nutrients and improves digestion.
Price and Where to Purchase Mitolyn with 90-Day Guarantee
Mitolyn can be purchased exclusively from its official website . Mitolyn is available in three different packages. Each packages are designed to meet different needs and budgets of different consumers:
Single-Bottle Order ($59): The single-bottle order of Mitolyn is perfectly designed for the first time or new consumers without any burden of further commitment.
Three-Bottle Package($147): Mitolyn three bottle package is a combo offer as it includes two free eBooks on detox and mindset.
Six-Bottle Package ($234): The six bottle combo is the perfect buy for those looking to invest in Mitolyn for the long-term. This package comes with two free eBooks plus free U.S. shipping.
Apart from consuming it directly, users can make several recipes from it. Read to know further.
How to Make Mitolyn- the Purple Peel Recipe at Home
The best aspect of Mitolyn-the Peel Exploit is that one can utilise its benefits by preparing a super healthy Purple Peel Recipe at home. The recipe includes highly nutritious food which improves digestion, enhances metabolism and energy levels.
Ingredients Required:
Take 1 cup of frozen blackberries or purple grape juice. The anthocyanins present in it boost fat metabolism and mitochondrial function.
Take 1 teaspoon of maca powder. It is responsible for maintaining the hormone and energy levels.
Take 1 teaspoon goji berry powder, which helps in appetite control.
Take 1 teaspoon of raw cacao powder. It act as a mood booster.
Take ½ teaspoon acai powder. It is responsible for proper fat oxidation and promotes metabolic activity.
Take a pinch of spirulina powder. With its detoxification quality, it helps in regulating hunger.
Take 1 cup coconut water. It is responsible for hydrating and providing essential electrolytes.
Recipe:
Now, add all the above mentioned ingredients into a blender. Blend it properly to make a smooth paste. If needed as a splash of coconut water to make the consistency normal. Now drink it immediately for proper nutrient absorption.
Customizations:
To enhance the Mitolyn- the Purple Peel taste one can add sweeter or honey or maple syrup.
To provide a creamier texture to the Mitolyn recipe, almond or oat milk can used instead of coconut water.
To make it more healthy and protein rich diet, add a scoop of protein powder.
To improve the metabolism rate, add a pinch of cinnamon or ginger powder on the Mitolyn- the Purple Peel Recipe.
Health Benefits of Mitolyn Purple Peel Recipe:
The above mentioned recipe is best suited for individuals:
Who suffer with slow metabolic activity.
Those aspiring to lose weight in a sustainable way.
Who are looking for quick nutritional support.
Who are suffering from low energy levels.
Who wants to cure bloating and related issues.
Benefits of Mitolyn
Mitolyn supplement’s unique composition makes it a super healthy food choice. Some of the major health benefits of Mitolyn are as follows:
Sustainable Energy
Mitolyn enhances the mitochondria rebound function, thereby, provides users sustained energy throughout the day.
Long-Term Fat Loss and No Weight Gain
Unlike other superficial and short-term weight loss solutions, Mitolyn works on the root cause and addresses metabolism activity at the cellular level. Thus, resulting in a long lasting sustainable reduction in body fat.
Mental and Physical Health
Mitolyn helps in maintaining the mental and physical well-being of an individual. It provides better thinking power, clarity, improves focus, and overall mental health. The functioning of the brain is very much dependent on mitochondria as it acts as a fuel and hence enhances memory, mood stability etc.
Why is Mitolyn an Effective Weight Management Supplement?
Mitolyn is not merely a weight loss supplement, it is a scientifically designed product that defines how body fat burns and generates energy.
Dealing with the main cause of slow metabolic activity, Mitolyn works effectively on increasing energy rate, natural weight loss method, and overall health. Mitolyn is a perfect combination of uniquely designed natural food supplements that offer long-term and effective ways of weight loss for those frustrated with temporary weight loss claims and promises made by other fat loss products in the market.
The plant-based ingredients of Mitolyn provides extensive scientific and natural back up. It is an innovative method that transforms health without making any extensive routine changes. As Mitolyn optimizes mitochondrial health it is a perfect solution for all weight management-related issues.
Contact Information:
Company: Mitolyn
Contact Name: John Monson
contact@mitolyn.work
Address: 285 Northeast Ave, Tallmadge, OH 44278 USA
Disclaimers:
The comments stated above are not verified by the Food and Drug Administration (FDA). Mitolyn doesn’t claim to diagnose, treat, cure, or prevent any disease. Weight-loss results may vary from person to person. It is advised to consult a doctor or healthcare expert before taking any supplement, especially for a pregnant woman, nursing, or person with a medical condition, or under medication. The above mentioned references to the scientific studies and institutions are mere for informational purposes. They are not for the endorsement of Mitolyn.",https://www.globenewswire.com/news-release/2025/03/21/3047328/0/en/Mitolyn-Reviews-And-Complaints-2025-Mitolyn-Work-Or-Not-Expert-Report-That-s-Needs-to-Be-Adopted-for-Which-Type-of-Customer.html,Mitolyn Work Or Not,www.globenewswire.com,Mitolyn Work,"Mitolyn Work, composed of plant based ingredients is a super food choice for health-oriented individuals. The article below highlights a detailed overview...",en
